Nome,Endereço,Telefone,Oferta
Pousada Chalés da Lua Juquehy,"R. Cesarino Onofre dos Santos, 80 - 85 - Juquehy, São Sebastião - SP, 11622-612, Brazil",(12) 99721-4065,Quimicos
Pousada Bella Juquehy,"R. Athayde Izidoro dos Santos, 399 - Juquehy, São Sebastião - SP, 11623-241, Brazil",(11) 98179-7645,Quimicos
Pousada Atobá - Juquehy - São Sebastião,"R. Alm. Cockrane, 72 - Juquehy, São Sebastião - SP, 11600-000, Brazil",(12) 3863-1611,Quimicos
Pousada Rosa dos Ventos - Juquehy,"R. Maria Madelena Faustino, 402 - Loja 2 - Praia de Juquehy, São Sebastião - SP, 11600-000, Brazil",(11) 96484-4373,Quimicos
Pousada Terra Juquehy,"Av - R. Benedito Izidoro de Morães, 460 - Juquehy, São Sebastião - SP, 11623-286, Brazil",(12) 3863-2100,Quimicos
Pousada Yamandu,"R. Maria Madelena Faustino, 477 - Juquehy, São Sebastião - SP, 11623-268, Brazil",(12) 99778-0256,Quimicos
Pousada do Almirante,"R. Maria Madelena Faustino, 201 - Juquehy, São Sebastião - SP, 11600-000, Brazil",(12) 3863-1514,Quimicos
Pousada Villa Encanto,"R. Joana Assumpção, 140 - Praia de Juquehy, São Sebastião - SP, 11623-229, Brazil",(12) 99635-8762,Quimicos
Tô Na Praia Juquehy,"Av. Mãe Bernarda, 2028 - Praia de Juquehy, São Sebastião - SP, 11623-304, Brazil",(11) 99865-3829,Quimicos
Casatua Pousada Juquehy,"Av. Mãe Bernarda, 1845 - Juquehy, São Sebastião - SP, 11623-304, Brazil",(12) 3863-2225,Quimicos
Juquei Frente ao Mar Hotel Pousada,"Av. Mãe Bernarda, 2192 - Juquehy, São Sebastião - SP, 11623-304, Brazil",(12) 3863-1571,Quimicos
Pousada Alcatrazes Juquehy | Hospedagem frente ao mar em São Sebastião SP,"Av. Mãe Bernarda, 937 - Juquehy, São Sebastião - SP, 11623-304, Brazil",(12) 3863-1135,Quimicos
Pousada Sol e Mar,"R. Benedito Izidoro de Morães, 392 - Juquehy, São Sebastião - SP, 11600-000, Brazil",(12) 3863-1666,Quimicos
Hiu Hotel Juquehy,"R. Argemiro Amâncio dos Santos, 263 - Juquehy, São Sebastião - SP, 11623-445, Brazil",(11) 93771-3001,Quimicos
Pousada Vila Do Sol Juquehy,"Av. Mauricio Benedito Faustino, 686 - Juquehy, São Sebastião - SP, 11623-250, Brazil",(12) 3863-2519,Quimicos
Pousada Montão do Trigo,"Av. Silvio Borges, 196 - Praia de Juquehy, São Sebastião - SP, 11600-000, Brazil",(12) 3863-2166,Quimicos
Pousada Baoba,"R. Anhanguera, 81 - Praia de Juquehy, São Sebastião - SP, 11600-000, Brazil",(11) 94718-7233,Quimicos
Pousada Bico Verde,"R. Tiradentes, 91 - Juquehy, São Sebastião - SP, 11600-000, Brazil",(12) 3863-1942,Quimicos
Recanto dos Tangarás,"R. Alm. Cockrane, 255 - Juquehy, São Sebastião - SP, 11622-618, Brazil",(12) 3863-2218,Quimicos
Pousada Tupinambá,"R. Athayde Izidoro dos Santos, 1026 - Juquehy, São Sebastião - SP, 11623-241, Brazil",(12) 3863-1936,Quimicos
Ipê Suítes Juquehy,"R. Athayde Izidoro dos Santos, 1066 - Juquehy, São Sebastião - SP, 11623-241, Brazil",(12) 98802-9093,Quimicos
Atlantic Forest Inn,"R. Gerôncio Bento Pereira | Rua, 278 - Juquehy, São Sebastião - SP, 11623-262, Brazil",(12) 3863-2033,Quimicos
Recanto Verde Praia Hotel,"R. Benedito Vitorino Dos Santos, 197 - Juquehy, São Sebastião - SP, 11623-103, Brazil",(13) 99181-5141,Quimicos
Juquehy La Plage Hotel,"Praia de - Av. Mãe Bernarda, 2020 - Juquehy, São Sebastião - SP, 11623-304, Brazil",(12) 3863-3434,Quimicos
Pousada Jabuti Juquehy,"R. Athayde Izidoro dos Santos, 374 - Praia de Juquehy, São Sebastião - SP, 11623-241, Brazil",(12) 99152-8556,Quimicos
Pousada Vila Real - Juquehy,"R. Teotônio São dos Santos, 503 - Juquehy, São Sebastião - SP, 11623-253, Brazil",(13) 99181-5141,Quimicos
Beach Hotel Juquehy,"Av. Mãe Bernarda, 25 - Juquehy, São Sebastião - SP, 11623-304, Brazil",(12) 2122-4888,Quimicos
Pousada Hippocampus,"R. Benedito Izidoro de Morães, 700 - Juquehy, São Sebastião - SP, 11623-286, Brazil",(12) 99609-9493,Quimicos
Chateau Gil Juquehy • 500m da Praia com Wi fi + Piscina + Ar Condicionado,"Av - R. Gerôncio Bento Pereira | Rua, 548 - Juquehy, São Sebastião - SP, 11600-000, Brazil",(11) 99214-5203,Quimicos
Bluehaus Juqueí Beach,"R. Maria Madelena Faustino, 614 - Juquehy, São Sebastião - SP, 11623-268, Brazil",,Quimicos
hospedagem Cantinho da Vovó Juquehy,"R. Eduardo T Santos, 141 - Juquehy, São Sebastião - SP, 11623-460, Brazil",(11) 97523-6051,Quimicos
